<?xml version="1.0" encoding="UTF-8" standalone="no"?>
<Resenje xmlns="http://resenje" xmlns:xsi="http://www.w3.org/2001/XMLSchema-instance" broj_resenja="000-00-0000/0000-00" datum_resenja="2006-05-04" id="ID001" xsi:schemaLocation="http://resenje resenje.xsd">
      
  <Opis_zalbe datum_zahteva="2006-05-04" razlog_zalbe="nepostupanje">
            Повереник за информације од јавног значаја и заштиту података о личности, 
        у поступку по алби коју је изјавио AA, због непоступања Учитељског факултета 
        у Призрену са привременим седиштем у Лепосавићу, ул. Немањина бб, 
        по његовом захтеву од 16.04.2020. године за приступ информацијама од 
        јавног значаја, на основу члана 35. став 1. тачка 5. Закона о слободном приступу
        информацијама од јавног значаја („Сл. гласник РС“, бр. 120/04, 54/07, 104/09 и 36/10),
        а у вези са чланом 4. тачка 22. Закона о заштити података о личности 
        („Сл. гласник РС“, број 87/18), као и члана 23. и члана 24. став 4. 
        Закона о слободном приступу информацијама од јавног значаја и члана 173. став 2. 
        Закона о општем управном поступку („Сл. гласник РС“, бр. 18/2016 и 95/2018-аутентично тумачење), 
        доноси
        
    <Podnosilac_zalbe>
                  
      <Ime>Mihailo</Ime>
                  
      <Prezime>Grujic</Prezime>
              
    </Podnosilac_zalbe>
            
    <Organ_vlasti>
                  
      <Naziv_organa>Uciteljski fakultet u Prizrenu</Naziv_organa>
                  
      <Sediste_organa>
                        
        <Mesto>Leposavic</Mesto>
                        
        <Ulica>Nemanjina</Ulica>
                        
        <Ulicni_broj>bb</Ulicni_broj>
                    
      </Sediste_organa>
              
    </Organ_vlasti>
            
    <Zakonska_osnova_resenja>
                  
      <Zakonska_osnova>
                        
        <Clan>35</Clan>
                        
        <Stav>1</Stav>
                        
        <Tacka>5</Tacka>
                        
        <Zakon>Закона о слободном приступу информацијама од јавног значаја</Zakon>
                        
        <Sluzbeni_glasnik>
                              
          <Naziv>Službeni glasnik RS</Naziv>
                              
          <Brojevi>
                                    
            <Broj>120/04</Broj>
                                    
            <Broj>54/07</Broj>
                                    
            <Broj>104/09</Broj>
                                    
            <Broj>36/10</Broj>
                                
          </Brojevi>
                          
        </Sluzbeni_glasnik>
                    
      </Zakonska_osnova>
                  
      <Zakonska_osnova>
                        
        <Clan>4</Clan>
                        
        <Tacka>22</Tacka>
                        
        <Zakon>Закона о заштити података о личности</Zakon>
                        
        <Sluzbeni_glasnik>
                              
          <Naziv>Službeni glasnik RS</Naziv>
                              
          <Brojevi>
                                    
            <Broj>87/18</Broj>
                                
          </Brojevi>
                          
        </Sluzbeni_glasnik>
                    
      </Zakonska_osnova>
                  
      <Zakonska_osnova>
                        
        <Clan>23</Clan>
                        
        <Zakon>Закона о слободном приступу информацијама од јавног значаја</Zakon>
                    
      </Zakonska_osnova>
                  
      <Zakonska_osnova>
                        
        <Clan>24</Clan>
                        
        <Stav>4</Stav>
                        
        <Zakon>Закона о слободном приступу информацијама од јавног значаја</Zakon>
                    
      </Zakonska_osnova>
                  
      <Zakonska_osnova>
                        
        <Clan>173</Clan>
                        
        <Stav>2</Stav>
                        
        <Zakon>Закона о општем управном поступку</Zakon>
                        
        <Sluzbeni_glasnik>
                              
          <Naziv>Službeni glasnik RS</Naziv>
                              
          <Brojevi>
                                    
            <Broj>18/16</Broj>
                                    
            <Broj>95/18</Broj>
                                
          </Brojevi>
                          
        </Sluzbeni_glasnik>
                    
      </Zakonska_osnova>
              
    </Zakonska_osnova_resenja>
        
  </Opis_zalbe>
      
  <Odluka>
            
    <Nalozi>
                  
      <Nalog rok_izvrsenja="5">
                I Налаже се Учитељском факултету у Призрену са привременим 
                седиштем у Лепосавићу, да без одлагања, а најкасније у року 
                од пет дана од дана пријема овог решења, обавести АА, 
                да ли поседује тражене информације односно документ у 
                коме су исте садржане, и то: Уговор о раду који је као последњи
                потписан између тог Факултета и ББ, те да му, уколико такав 
                документ поседује достави копију истог електронском поштом на
                адресу … или поштом, с тим што ће пре достављања заштитити и 
                учинити недоступним податке о личности којима би се повредило 
                право на приватност лица на које се информације односе, 
                као што су: адреса становања, лични матични број грађана, име 
                оца, радни стаж, просечна оцена студирања и сл. уколико су 
                такви подаци садржани у траженом документу.
            </Nalog>
                  
      <Nalog rok_izvrsenja="7">
                II О извршењу решења Учитељски факултет у Призрену са привременим
                седиштем у Лепосавићу, ће обавестити Повереника у року од седам 
                дана од пријема овог решења.
            </Nalog>
              
    </Nalozi>
        
  </Odluka>
      
  <Obrazlozenje>
            
    <Postupak_zalioca prilozene_kopije="true">
                  
      <Podnosenje_zalbe datum_zalbe="2020-05-07">
                АА, као тражилац информација, изјавио је дана 07.05.2020. 
                године жалбу Поверенику, због непоступања Учитељског факултета 
                у Призрену са привременим седиштем у Лепосавићу
            </Podnosenje_zalbe>
                  
      <Podnosenje_zahteva datum_zahteva="2020-04-16">
                по његовом захтеву од 16.04.2020. године за приступ информацијама
                од јавног значаја и у прилогу доставио копију истог.
            </Podnosenje_zahteva>
              
    </Postupak_zalioca>
            
    <Prosledjivanje_zalbe datum_prosledjivanja="2020-05-11">
                  Поступајући по жалби, Повереник је дана 11.05.2020. године упутио 
            исту на изјашњење Учитељском факултету у Призрену са привременим 
            седиштем у Лепосавићу, као органу власти у смислу члана 3. 
            Закона о слободном приступу информацијама од јавног значаја и
            затражио да се изјасни о наводима жалбе, посебно о разлозима 
            непоступања у законском року по поднетом захтеву у складу са 
            одредбама члана 16. ст.1-9. или ст. 10. Закона,
            
      <Zakonska_osnova_prosledjivanja>
                        
        <Zakonska_osnova>
                              
          <Clan>3</Clan>
                              
          <Zakon>Закон о слободном приступу информацијама од јавног значаја</Zakon>
                          
        </Zakonska_osnova>
                        
        <Zakonska_osnova>
                              
          <Clan>16</Clan>
                              
          <Stav>10</Stav>
                              
          <Zakon>Закон о слободном приступу информацијама од јавног значаја</Zakon>
                          
        </Zakonska_osnova>
                    
      </Zakonska_osnova_prosledjivanja>
              
    </Prosledjivanje_zalbe>
            
    <Odgovor_na_zalbu rok_za_odgovor="8">
            поводом чега није добио одговор.
        </Odgovor_na_zalbu>
            
    <Razlozi_odluke>
                  По разматрању жалбе и осталих списа овог предмета, 
            донета је одлука као у диспозитиву решења из следећих разлога:
            
      <Detaljan_opis_podnetog_zahteva>
                Увидом у списе предмета утврђено је да је АА, дана 16.04.2020. године, 
                поднео Учитељском факултету у Призрену са привременим седиштем у Лепосавићу, 
                захтев за приступ информацијама од јавног значаја, електронском поштом, 
                којим је тражио информације од јавног значаја, ближе наведенe у ставу 
                I диспозитива овог решења.
            </Detaljan_opis_podnetog_zahteva>
                  
      <Detaljan_opis_odgovora_na_zahtev>
                        Такође је увидом у списе предмета утврђено да по захтеву жалиоца 
                од 16.04.2020. године, орган власти није поступио, што је био дужан да 
                учини без одлагања, а најкасније у року од 15 дана од пријема захтева 
                те да жалиоца, у смислу члана 16. став 1. Закона о слободном приступу 
                информацијама од јавног значаја, обавести да ли поседује тражене 
                информације и да му, уколико исте поседује, стави на увид документ 
                који исте садржи односно изда му или достави копију документа у коме 
                су тражене информације садржане, или да у супротном донесе решење о 
                одбијању захтева, у смислу става 10. истог члана.
                
        <Zakonska_osnova_odgovora>
                              
          <Zakonska_osnova>
                                    
            <Clan>16</Clan>